{
  "schemaVersion": 1,
  "baselineId": "framework-current-20260830",
  "status": "active",
  "createdAt": "2026-08-30T00:00:00+08:00",
  "canonicalSpecSourceId": "FRAMEWORK-SPEC",
  "truthSources": [
    {
      "sourceId": "FRAMEWORK-SPEC",
      "path": "docs/framework-spec.md",
      "role": "product_content_truth",
      "authority": "canonical",
      "digest": "sha256:6f4378a018432e294246a49b7238352abd690ee964df64cead5fb71a13313db6"
    }
  ],
  "knownConflicts": [],
  "decisionRegister": "ai-dev/decisions/register.json"
}
